{
  "$schema": "https://json-schema.org/draft/2020-12/schema",
  "$id": "https://github.com/gasyoun/SamudraManthanam/blob/main/web/corpus_builder/manifest/schema-v1.json",
  "title": "Samudra Manthanam corpus manifest, schema v1",
  "description": "Content-addressed enumeration of the canonical JSONL that makes up one immutable corpus bundle. The `bundle` object is a pure function of the inputs and carries no wall-clock field, so two builds from identical inputs are byte-identical; event-time provenance belongs in build reports, not here.",
  "type": "object",
  "additionalProperties": false,
  "required": ["schema_version", "bundle", "build", "content_hash"],
  "properties": {
    "schema_version": {
      "description": "Manifest schema generation. Bumped only on a breaking shape change.",
      "type": "integer",
      "const": 1
    },
    "content_hash": {
      "description": "sha256 over the canonical JSON serialization of `bundle` alone. Identifies the bundle content; stable across rebuilds at a different build revision.",
      "$ref": "#/$defs/prefixedSha256"
    },
    "build": {
      "type": "object",
      "additionalProperties": false,
      "required": ["generator", "revision"],
      "properties": {
        "generator": {
          "description": "Tool identity that produced the manifest, e.g. corpus_manifest/1.",
          "type": "string",
          "minLength": 1
        },
        "revision": {
          "description": "Source revision the build ran at (git sha, or 'unknown' outside a checkout).",
          "type": "string",
          "minLength": 1
        }
      }
    },
    "bundle": {
      "type": "object",
      "additionalProperties": false,
      "required": [
        "bundle_version",
        "corpus_root",
        "sources",
        "generated_artifacts",
        "totals"
      ],
      "properties": {
        "bundle_version": {
          "description": "Release label for this bundle. An input to the build, never derived from a clock.",
          "type": "string",
          "minLength": 1,
          "pattern": "^[A-Za-z0-9][A-Za-z0-9._-]*$"
        },
        "corpus_root": {
          "description": "Directory every `path` in this manifest is relative to, itself relative to the repository root.",
          "$ref": "#/$defs/relativePath"
        },
        "sources": {
          "description": "Every canonical source in the bundle, ordered by (sort_order, slug).",
          "type": "array",
          "minItems": 1,
          "items": { "$ref": "#/$defs/source" }
        },
        "generated_artifacts": {
          "description": "Inventory of the views this bundle is expected to generate. Actual output hashes are recorded by build reports against this manifest's content_hash, never written back here.",
          "type": "array",
          "items": { "$ref": "#/$defs/generatedArtifact" }
        },
        "totals": {
          "type": "object",
          "additionalProperties": false,
          "required": ["source_count", "record_count", "canonical_bytes"],
          "properties": {
            "source_count": { "type": "integer", "minimum": 1 },
            "record_count": { "type": "integer", "minimum": 0 },
            "canonical_bytes": { "type": "integer", "minimum": 0 }
          }
        }
      }
    }
  },
  "$defs": {
    "sha256": {
      "type": "string",
      "pattern": "^[a-f0-9]{64}$"
    },
    "prefixedSha256": {
      "type": "string",
      "pattern": "^sha256:[a-f0-9]{64}$"
    },
    "relativePath": {
      "description": "Forward-slash relative path. Absolute paths and parent traversal are rejected so a manifest is host-independent.",
      "type": "string",
      "minLength": 1,
      "pattern": "^(?!/)(?!.*(^|/)\\.\\.(/|$))[^\\\\:*?\"<>|]+$"
    },
    "fileRef": {
      "type": "object",
      "additionalProperties": false,
      "required": ["path", "sha256", "bytes"],
      "properties": {
        "path": { "$ref": "#/$defs/relativePath" },
        "sha256": { "$ref": "#/$defs/sha256" },
        "bytes": { "type": "integer", "minimum": 0 }
      }
    },
    "source": {
      "type": "object",
      "additionalProperties": false,
      "required": ["slug", "filename", "sort_order", "title", "provenance", "canonical"],
      "properties": {
        "slug": {
          "description": "Stable URL/identity slug. Unique across the bundle.",
          "type": "string",
          "minLength": 1,
          "pattern": "^[a-z0-9][a-z0-9_-]*$"
        },
        "filename": {
          "description": "Legacy desktop corpus filename this source is published under.",
          "type": "string",
          "minLength": 1
        },
        "sort_order": { "type": "integer", "minimum": 0 },
        "title": { "type": "string", "minLength": 1 },
        "provenance": {
          "description": "Where the canonical text came from. Required: a bundle may not contain a source of unrecorded origin.",
          "type": "string",
          "minLength": 1
        },
        "rights": {
          "description": "Known rights facts, recorded rather than adjudicated. Absent means not yet recorded, never means unrestricted.",
          "type": "string"
        },
        "canonical": {
          "description": "The JSONL that is actually ingested and published for this source.",
          "type": "object",
          "additionalProperties": false,
          "required": ["path", "sha256", "bytes", "record_count"],
          "properties": {
            "path": { "$ref": "#/$defs/relativePath" },
            "sha256": { "$ref": "#/$defs/sha256" },
            "bytes": { "type": "integer", "minimum": 0 },
            "record_count": { "type": "integer", "minimum": 1 },
            "first_canonical_id": { "type": "string", "minLength": 1 },
            "last_canonical_id": { "type": "string", "minLength": 1 }
          }
        },
        "source_file": {
          "description": "Optional upstream HTML/text the canonical JSONL was derived from. A compatibility view, never the publication input.",
          "$ref": "#/$defs/fileRef"
        },
        "metadata": {
          "description": "Optional sibling .meta.json carrying bibliographic fields.",
          "$ref": "#/$defs/fileRef"
        }
      }
    },
    "generatedArtifact": {
      "type": "object",
      "additionalProperties": false,
      "required": ["name", "kind", "required"],
      "properties": {
        "name": { "type": "string", "minLength": 1 },
        "kind": {
          "type": "string",
          "enum": ["web-db", "offline-pack", "desktop-view", "export"]
        },
        "required": { "type": "boolean" }
      }
    }
  }
}
