{
  "build": {
    "generator": "corpus_manifest/1",
    "revision": "68d158a7cb57be8db21868a42fcabad7de248fca"
  },
  "bundle": {
    "bundle_version": "2026.08",
    "corpus_root": "web",
    "generated_artifacts": [
      {
        "kind": "web-db",
        "name": "corpus.db",
        "required": true
      },
      {
        "kind": "offline-pack",
        "name": "base.db",
        "required": true
      },
      {
        "kind": "offline-pack",
        "name": "dict.db",
        "required": true
      },
      {
        "kind": "desktop-view",
        "name": "desktop-html",
        "required": false
      }
    ],
    "sources": [
      {
        "canonical": {
          "bytes": 4049630,
          "first_canonical_id": "slovar-smirnova:e1",
          "last_canonical_id": "slovar-smirnova:e3641",
          "path": "corpus_builder/jsonl/slovar-smirnova.jsonl",
          "record_count": 3641,
          "sha256": "5ce7464a00976d38f251adb0718610b70f6d78841b7dcc309610cffd488f7906"
        },
        "filename": "Словарь Смирнова.txt",
        "provenance": "print edition unknown — digital source TBD",
        "rights": "in-copyright academic edition (named translator/editor, 20th-21st c.) — corpus rights stay grey per project ruling; no redistribution",
        "slug": "slovar-smirnova",
        "sort_order": 0,
        "title": "Симфонический словарь (1955-1989); Б.Л. Смирнов"
      },
      {
        "canonical": {
          "bytes": 1997918,
          "first_canonical_id": "knauer:e1",
          "last_canonical_id": "knauer:e3271",
          "path": "corpus_builder/jsonl/knauer.jsonl",
          "record_count": 3271,
          "sha256": "29a2093eb983731ea47c9b096ee64652d1a83818eb4e00be1fce31cccad0e1b7"
        },
        "filename": "Кнауэр.txt",
        "provenance": "print edition unknown — digital source TBD",
        "rights": "public domain (pre-1929 edition; translator/author long deceased)",
        "slug": "knauer",
        "sort_order": 1,
        "title": "Учебник санскритского языка (1908); Ф.И. Кнауэр"
      },
      {
        "canonical": {
          "bytes": 10495047,
          "first_canonical_id": "kossovich:e1",
          "last_canonical_id": "kossovich:e13488",
          "path": "corpus_builder/jsonl/kossovich.jsonl",
          "record_count": 13488,
          "sha256": "40824f009e100113de417915d5edffd70ec3f3174aca50de8442a99e0c8e8047"
        },
        "filename": "Коссович.txt",
        "provenance": "print edition unknown — digital source TBD",
        "rights": "public domain (pre-1929 edition; translator/author long deceased)",
        "slug": "kossovich",
        "sort_order": 2,
        "title": "Санскрито-русский словарь (1854); К.А. Коссович"
      },
      {
        "canonical": {
          "bytes": 4306634,
          "first_canonical_id": "frish:p1",
          "last_canonical_id": "frish:p8156",
          "path": "corpus_builder/jsonl/frish.jsonl",
          "record_count": 8156,
          "sha256": "92715bec19cee2b5906341e79d6add656b8795ac2ce4d241baf7306294931ba5"
        },
        "filename": "Фриш.txt",
        "provenance": "print edition unknown — digital source TBD",
        "rights": "in-copyright academic edition (named translator/editor, 20th-21st c.) — corpus rights stay grey per project ruling; no redistribution",
        "slug": "frish",
        "sort_order": 3,
        "title": "Санскритская хрестоматия. Т. II. Словарь (1956); О. Фриш"
      },
      {
        "canonical": {
          "bytes": 15176612,
          "first_canonical_id": "kochergina:e1",
          "last_canonical_id": "kochergina:e29180",
          "path": "corpus_builder/jsonl/kochergina.jsonl",
          "record_count": 29180,
          "sha256": "299e34d9fda564f8ce27d9589dc8904fe94f25eab2f67cf3d18eb13c273c746f"
        },
        "filename": "Кочергина.txt",
        "provenance": "print edition unknown — digital source TBD",
        "rights": "in-copyright academic edition (named translator/editor, 20th-21st c.) — corpus rights stay grey per project ruling; no redistribution",
        "slug": "kochergina",
        "sort_order": 4,
        "title": "Санскритско-русский словарь (1987); В.А. Кочергина"
      },
      {
        "canonical": {
          "bytes": 4926199,
          "first_canonical_id": "kewa:e1",
          "last_canonical_id": "kewa:e9587",
          "path": "corpus_builder/jsonl/kewa.jsonl",
          "record_count": 9587,
          "sha256": "2bf10ebac4ae62cb46422d76bdbff88b5dc1a6b6c83f272641354afedb1f99fb"
        },
        "filename": "KEWA.txt",
        "provenance": "print edition unknown — digital source TBD",
        "rights": "in-copyright academic edition (named translator/editor, 20th-21st c.) — corpus rights stay grey per project ruling; no redistribution",
        "slug": "kewa",
        "sort_order": 5,
        "title": "KEWA, A Concise Etymological Sanskrit Dictionary (1953-1980); M. Mayrhofer"
      },
      {
        "canonical": {
          "bytes": 157948406,
          "first_canonical_id": "dic_mw:e1",
          "last_canonical_id": "dic_mw:e222390",
          "path": "corpus_builder/jsonl/dic_mw.jsonl",
          "record_count": 222390,
          "sha256": "ffe25b54e2f76c594add36f9f9b5365192df7608f182c64296c53771e4828709"
        },
        "filename": "Dic_MW.txt",
        "provenance": "print edition unknown — digital source TBD",
        "rights": "public domain (pre-1929 edition; translator/author long deceased)",
        "slug": "dic_mw",
        "sort_order": 6,
        "title": "A Sanskrit-English Dictionary (1899); Monier-Williams"
      },
      {
        "canonical": {
          "bytes": 28948754,
          "first_canonical_id": "dic_apte:e1",
          "last_canonical_id": "dic_apte:e31647",
          "path": "corpus_builder/jsonl/dic_apte.jsonl",
          "record_count": 31647,
          "sha256": "575f0b4645be3ee858897a9ce2872e2baad825bd7d4726345f6d5ce0a230620c"
        },
        "filename": "Dic_Apte.txt",
        "provenance": "print edition unknown — digital source TBD",
        "rights": "public domain (pre-1929 edition; translator/author long deceased)",
        "slug": "dic_apte",
        "sort_order": 7,
        "title": "The Practical Sanskrit-English Dictionary (1890); Apte, Vaman Shivaram"
      },
      {
        "canonical": {
          "bytes": 9845235,
          "first_canonical_id": "dsg:e1",
          "last_canonical_id": "dsg:e4383",
          "path": "corpus_builder/jsonl/dsg.jsonl",
          "record_count": 4383,
          "sha256": "3057fe4a37dd99ea30d30634aae86056a94ddf3d279dfecca521a7dffe77d489"
        },
        "filename": "dsg.txt",
        "provenance": "print edition unknown — digital source TBD",
        "rights": "in-copyright academic edition (named translator/editor, 20th-21st c.) — corpus rights stay grey per project ruling; no redistribution",
        "slug": "dsg",
        "sort_order": 8,
        "title": "A DICTIONARY OF SANSKRIT GRAMMAR (1961); KASHINATH VASUDEV ABHYANKAR"
      },
      {
        "canonical": {
          "bytes": 4731384,
          "first_canonical_id": "fasmer-dr-ind:e1",
          "last_canonical_id": "fasmer-dr-ind:e1412",
          "path": "corpus_builder/jsonl/fasmer-dr-ind.jsonl",
          "record_count": 1412,
          "sha256": "491c9b9b99d40738a7484d4e77a5189c01584c939978f758162567b6a3d27b37"
        },
        "filename": "fasmer-dr-ind.htm",
        "provenance": "print edition unknown — digital source TBD",
        "rights": "in-copyright academic edition (named translator/editor, 20th-21st c.) — corpus rights stay grey per project ruling; no redistribution",
        "slug": "fasmer-dr-ind",
        "sort_order": 9,
        "title": "Этимологический словарь русского языка (1964-1973); М.Фасмер"
      },
      {
        "canonical": {
          "bytes": 235821,
          "first_canonical_id": "slovar-potapovoy:e1",
          "last_canonical_id": "slovar-potapovoy:e339",
          "path": "corpus_builder/jsonl/slovar-potapovoy.jsonl",
          "record_count": 339,
          "sha256": "9005cf59ef8cc30052967fb2c383386bf588d04852e3ada1fe3b81aa22557702"
        },
        "filename": "Словарь Потаповой.txt",
        "provenance": "print edition unknown — digital source TBD",
        "rights": "in-copyright academic edition (named translator/editor, 20th-21st c.) — corpus rights stay grey per project ruling; no redistribution",
        "slug": "slovar-potapovoy",
        "sort_order": 10,
        "title": "Словарь к «Рамаяне» (1986); Б.А. Захарьин , В.А. Потапова"
      },
      {
        "canonical": {
          "bytes": 1999471,
          "first_canonical_id": "warnemyr:e1",
          "last_canonical_id": "warnemyr:e937",
          "path": "corpus_builder/jsonl/warnemyr.jsonl",
          "record_count": 937,
          "sha256": "29010d24e199092882701c635605b9a76d641431afa996ff4a86f822b2a087da"
        },
        "filename": "warnemyr.txt",
        "provenance": "print edition unknown — digital source TBD",
        "rights": "public domain (pre-1929 edition; translator/author long deceased)",
        "slug": "warnemyr",
        "sort_order": 11,
        "title": "Глагольные корни Уитни (1885); W.D. Whitney"
      },
      {
        "canonical": {
          "bytes": 328952,
          "first_canonical_id": "slovar-grintsera-iz-ramayany-1-2:e1",
          "last_canonical_id": "slovar-grintsera-iz-ramayany-1-2:e462",
          "path": "corpus_builder/jsonl/slovar-grintsera-iz-ramayany-1-2.jsonl",
          "record_count": 462,
          "sha256": "381038cbcc856bd8c214f6b80a83fcb23f6536e7e8fba407b9022c1b05ad5e43"
        },
        "filename": "Словарь Гринцера из Рамаяны 1-2.txt",
        "provenance": "print edition unknown — digital source TBD",
        "rights": "in-copyright academic edition (named translator/editor, 20th-21st c.) — corpus rights stay grey per project ruling; no redistribution",
        "slug": "slovar-grintsera-iz-ramayany-1-2",
        "sort_order": 12,